{
  "canary": {
    "sha256": "0000000000000000000000000000000000000000000000000000000000000000",
    "source_events": 0
  },
  "format": "commcanary.report.v2",
  "metrics": {
    "arrival_skew_max_us": 0.0,
    "arrival_skew_median_us": 0.0,
    "arrival_skew_p95_us": 0.0,
    "avg_rank_wait_median_us": 0.0,
    "communication_hidden_pct": 0.0,
    "count": 0,
    "max_us": 0.0,
    "mean_us": 0.0,
    "median_us": 0.0,
    "p95_us": 0.0,
    "p99_us": 0.0
  },
  "replay_protocol": {
    "bandwidth_unit": "Gbit/s",
    "iterations": 1,
    "model_name": "commcanary.replay",
    "model_version": "fixture-v1",
    "quantile_method": "linear-interpolated-sorted",
    "seed": 7,
    "sha256": "8d124cb2027b98d38360fae19674dea6337cac272c42107da04af1442cdf0180"
  },
  "simulation_model": {
    "version": "fixture-v1"
  }
}
